[
  {
    "chunk_id": "LAW-001481-J012-H01",
    "law_id": "001481",
    "law_name": "국가연구개발혁신법",
    "law_short_name": "혁신법",
    "law_type": "법률",
    "hierarchy_level": 1,
    "binding_power": 5,
    "article_no": "12",
    "article_title": "협약의 변경",
    "paragraph_no": "1",
    "chapter_section": "제3장 연구개발과제의 협약",
    "promulgation_date": "2020-06-09",
    "enforce_date": "2021-01-01",
    "article_enforce_date": "2021-01-01",
    "is_repealed": false,
    "valid_from": "2021-01-01",
    "valid_to": null,
    "topic_tags": ["협약변경"],
    "parent_law_ref": null,
    "cites": [],
    "exception_of": null,
    "context_prefix": "이 조문은 국가연구개발혁신법 제3장 협약 중 협약 변경의 원칙적 절차를 정한다. 협약 내용을 변경할 때 원칙적으로 사전 합의(승인)를 요구한다.",
    "body_text": "제12조(협약의 변경) ① 중앙행정기관의 장과 연구개발기관의 장은 협약으로 정하는 바에 따라 협약의 내용을 변경할 수 있다. 이 경우 대통령령으로 정하는 중요한 사항을 변경할 때에는 미리 협의하여야 한다.",
    "parent_chunk_id": "LAW-001481-J012",
    "source_url": "https://www.law.go.kr/법령/국가연구개발혁신법/제12조",
    "version_hash": null
  },
  {
    "chunk_id": "LAW-001481-J012-H02",
    "law_id": "001481",
    "law_name": "국가연구개발혁신법",
    "law_short_name": "혁신법",
    "law_type": "법률",
    "hierarchy_level": 1,
    "binding_power": 5,
    "article_no": "12",
    "article_title": "협약의 변경",
    "paragraph_no": "2",
    "chapter_section": "제3장 연구개발과제의 협약",
    "promulgation_date": "2020-06-09",
    "enforce_date": "2021-01-01",
    "article_enforce_date": "2021-01-01",
    "is_repealed": false,
    "valid_from": "2021-01-01",
    "valid_to": null,
    "topic_tags": ["협약변경"],
    "parent_law_ref": null,
    "cites": ["제12조제1항"],
    "exception_of": "제12조제1항",
    "context_prefix": "이 조문은 협약 변경의 위임 규정으로, 변경 시 협의 대상이 되는 중요한 사항의 구체적 범위를 대통령령에 위임한다.",
    "body_text": "② 제1항 후단에 따른 중요한 사항의 범위와 협약 변경의 절차 등에 관하여 필요한 사항은 대통령령으로 정한다.",
    "parent_chunk_id": "LAW-001481-J012",
    "source_url": "https://www.law.go.kr/법령/국가연구개발혁신법/제12조",
    "version_hash": null
  },
  {
    "chunk_id": "LAW-002100-J015-H01",
    "law_id": "002100",
    "law_name": "국가연구개발혁신법 시행령",
    "law_short_name": "혁신법 시행령",
    "law_type": "대통령령",
    "hierarchy_level": 2,
    "binding_power": 4,
    "article_no": "15",
    "article_title": "협약의 변경",
    "paragraph_no": "1",
    "chapter_section": "제3장 연구개발과제의 협약",
    "promulgation_date": "2020-12-29",
    "enforce_date": "2021-01-01",
    "article_enforce_date": "2024-07-01",
    "is_repealed": false,
    "valid_from": "2024-07-01",
    "valid_to": null,
    "topic_tags": ["협약변경"],
    "parent_law_ref": "국가연구개발혁신법 제12조제2항",
    "cites": ["법 제12조"],
    "exception_of": null,
    "context_prefix": "이 조문은 혁신법 제12조제2항의 위임을 받아, 협약 변경 시 사전 협의가 필요한 '중요한 사항'의 구체적 범위를 열거한다. 연구책임자 변경·연구개발비 증액 등이 여기에 포함되는지를 판단하는 핵심 근거다.",
    "body_text": "제15조(협약의 변경) ① 법 제12조제2항에 따라 미리 협의하여야 하는 중요한 사항은 다음 각 호와 같다. 1. 연구개발과제의 연구책임자 변경 2. 연구개발기관의 변경·추가 또는 제외 3. 연구개발기간의 변경 4. 연구개발비의 증액 또는 대통령령으로 정하는 비율을 초과하는 항목 간 변경",
    "parent_chunk_id": "LAW-002100-J015",
    "source_url": "https://www.law.go.kr/법령/국가연구개발혁신법시행령/제15조",
    "version_hash": null
  },
  {
    "chunk_id": "LAW-003050-J008-H01",
    "law_id": "003050",
    "law_name": "국가연구개발사업 연구개발비 사용기준",
    "law_short_name": "사용기준",
    "law_type": "고시",
    "hierarchy_level": 4,
    "binding_power": 3,
    "article_no": "8",
    "article_title": "연구개발비의 변경",
    "paragraph_no": "1",
    "chapter_section": "제2장 연구개발비의 계상 및 집행",
    "promulgation_date": "2023-01-01",
    "enforce_date": "2023-01-01",
    "article_enforce_date": "2023-01-01",
    "is_repealed": false,
    "valid_from": "2023-01-01",
    "valid_to": null,
    "topic_tags": ["협약변경", "연구비집행"],
    "parent_law_ref": "국가연구개발혁신법 시행령 제15조",
    "cites": ["별표3"],
    "exception_of": null,
    "context_prefix": "이 조문은 연구개발비 항목 간 변경(전용) 시 승인이 필요한 기준을 정한다. 직접비 비목 간 전용의 승인 대상 여부를 판단하는 실무 근거다.",
    "body_text": "제8조(연구개발비의 변경) ① 연구책임자는 직접비 비목 간 변경을 하려는 경우 별표3에서 정한 비율 이내에서는 자체 조정할 수 있으며, 이를 초과하는 경우 연구개발기관의 장의 승인을 받아야 한다.",
    "parent_chunk_id": "LAW-003050-J008",
    "source_url": "https://www.law.go.kr/행정규칙/국가연구개발사업연구개발비사용기준/제8조",
    "version_hash": null
  },
  {
    "chunk_id": "LAW-003050-B003",
    "law_id": "003050",
    "law_name": "국가연구개발사업 연구개발비 사용기준",
    "law_short_name": "사용기준",
    "law_type": "고시",
    "hierarchy_level": 4,
    "binding_power": 3,
    "article_no": "별표3",
    "article_title": "직접비 비목 간 자체 변경 가능 비율",
    "paragraph_no": null,
    "chapter_section": "별표",
    "promulgation_date": "2023-01-01",
    "enforce_date": "2023-01-01",
    "article_enforce_date": "2023-01-01",
    "is_repealed": false,
    "valid_from": "2023-01-01",
    "valid_to": null,
    "topic_tags": ["연구비집행", "협약변경"],
    "parent_law_ref": "국가연구개발사업 연구개발비 사용기준 제8조",
    "cites": [],
    "exception_of": null,
    "context_prefix": "이 별표는 사용기준 제8조가 정한 '자체 조정 가능 비율'의 구체적 수치를 비목별로 제시하는 표다. 승인 없이 조정 가능한 한도를 판단하는 조회형 데이터다.",
    "body_text": "[별표3] 직접비 비목 간 자체 변경 가능 비율\n| 비목 | 자체 변경 가능 한도 | 승인 필요 기준 |\n| 인건비 | 해당 비목의 20% 이내 | 20% 초과 시 |\n| 연구시설·장비비 | 10% 이내 | 10% 초과 시 |\n| 재료비 | 30% 이내 | 30% 초과 시 |",
    "parent_chunk_id": null,
    "source_url": "https://www.law.go.kr/행정규칙/국가연구개발사업연구개발비사용기준/별표3",
    "version_hash": null
  }
]
